{
  "$schema": "../schemas/claude-marketplace.schema.json",
  "name": "slop-market",
  "description": "A cross-compatible plugin marketplace for Codex-first plugins that can also load in Claude Code.",
  "version": "0.1.0",
  "owner": {
    "name": "Jason Rigby",
    "email": "jason@jasonrig.by"
  },
  "plugins": [
    {
      "name": "language-experts",
      "source": "./plugins/language-experts",
      "description": "Language-specific expert skills for authoring, reviewing, and refactoring code."
    }
  ]
}
